<?xml version="1.0" encoding="UTF-8"?>
<!DOCTYPE building SYSTEM "../building.dtd" >
<building worker="" viewdistance="40">
	<ground groundtype="GRASS"/>
	<ground groundtype="EARTH"/>
	<ground groundtype="FLATTENED"/>

	<blocked dx="-5" dy="0" />
	<blocked dx="-4" dy="1" />
	<blocked dx="-1" dy="2" />
	<blocked dx="-2" dy="1" />
	<blocked dx="-3" dy="1" />
	<blocked dx="-3" dy="0" />
	<blocked dx="-4" dy="0" />
	<blocked dx="-4" dy="-1" />
	<blocked dx="-5" dy="-1" />
	<blocked dx="-5" dy="-2" />
	<blocked dx="-5" dy="-3" />
	<blocked dx="-4" dy="-3" />
	<blocked dx="-4" dy="-4" />
	<blocked dx="-4" dy="-5" />
	<blocked dx="-3" dy="-5" />
	<blocked dx="-3" dy="-6" />
	<blocked dx="-3" dy="-7" />
	<blocked dx="-4" dy="-7" />
	<blocked dx="-4" dy="-6" />
	<blocked dx="-2" dy="-6" />
	<blocked dx="-1" dy="-5" />
	<blocked dx="0" dy="-4" />
	<blocked dx="1" dy="-3" />
	<blocked dx="2" dy="-2" />
	<blocked dx="3" dy="-1" />
	<blocked dx="4" dy="1" />
	<blocked dx="4" dy="0" />
	<blocked dx="3" dy="1" />
	<blocked dx="4" dy="2" />
	<blocked dx="4" dy="3" />
	<blocked dx="3" dy="0" />
	<blocked dx="3" dy="2" />
	<blocked dx="3" dy="3" />
	<blocked dx="3" dy="4" />
	<blocked dx="3" dy="5" />
	<blocked dx="3" dy="6" />
	<blocked dx="2" dy="5" />
	<blocked dx="1" dy="4" />
	<blocked dx="0" dy="3" />
	<blocked dx="-4" dy="-2" />
	<blocked dx="-3" dy="-4" />
	<blocked dx="-3" dy="-3" />
	<blocked dx="-3" dy="-2" />
	<blocked dx="-3" dy="-1" />
	<blocked dx="-2" dy="0" />
	<blocked dx="-2" dy="-1" />
	<blocked dx="-2" dy="-2" />
	<blocked dx="-2" dy="-3" />
	<blocked dx="-2" dy="-4" />
	<blocked dx="-2" dy="-5" />
	<blocked dx="-1" dy="-4" />
	<blocked dx="-1" dy="-3" />
	<blocked dx="-1" dy="-2" />
	<blocked dx="-1" dy="-1" />
	<blocked dx="-1" dy="0" />
	<blocked dx="-1" dy="1" />
	<blocked dx="0" dy="-3" />
	<blocked dx="0" dy="-2" />
	<blocked dx="0" dy="-1" />
	<blocked dx="0" dy="0" />
	<blocked dx="0" dy="1" />
	<blocked dx="0" dy="2" />
	<blocked dx="1" dy="3" />
	<blocked dx="1" dy="2" />
	<blocked dx="1" dy="1" />
	<blocked dx="1" dy="0" />
	<blocked dx="1" dy="-1" />
	<blocked dx="1" dy="-2" />
	<blocked dx="2" dy="-1" />
	<blocked dx="2" dy="0" />
	<blocked dx="2" dy="1" />
	<blocked dx="2" dy="2" />
	<blocked dx="2" dy="3" />
	<blocked dx="2" dy="4" />
	<blocked dx="5" dy="3" />
	<blocked dx="6" dy="1" />
	<blocked dx="1" dy="-4" />
	<blocked dx="2" dy="-3" />
	<blocked dx="3" dy="-2" />
	<blocked dx="4" dy="-1" />
	<blocked dx="5" dy="0" />
	<blocked dx="5" dy="1" />
	<blocked dx="5" dy="2" />
	<blocked dx="-6" dy="-1" />
	<blocked dx="-1" dy="-6" />
	<blocked dx="-4" dy="-9" />
	<blocked dx="-3" dy="-8" />
	<blocked dx="-2" dy="-7" />
	<blocked dx="-5" dy="-10" />
	<blocked dx="-4" dy="-8" />
	<blocked dx="-3" dy="2" />
	<blocked dx="-6" dy="-2" />
	<blocked dx="-6" dy="-3" />
	<blocked dx="0" dy="-5" />
	<blocked dx="4" dy="7" />
	<blocked dx="4" dy="6" />
	<blocked dx="4" dy="5" />
	<blocked dx="4" dy="4" />

	<blocked dx="5" dy="4" block="false" />
	<blocked dx="-5" dy="-8" block="false" />
	<blocked dx="-5" dy="-6" block="false" />
	<blocked dx="-5" dy="-7" block="false" />
	<blocked dx="-5" dy="-4" block="false" />
	<blocked dx="-6" dy="-4" block="false" />
	<blocked dx="-6" dy="0" block="false" />
	<blocked dx="-5" dy="1" block="false" />
	<blocked dx="-4" dy="2" block="false" />
	<blocked dx="-3" dy="3" block="false" />
	<blocked dx="-2" dy="3" block="false" />
	<blocked dx="0" dy="5" block="false" />
	<blocked dx="1" dy="6" block="false" />
	<blocked dx="3" dy="7" block="false" />
	<blocked dx="4" dy="8" block="false" />
	<blocked dx="-2" dy="4" block="false" />
	<blocked dx="5" dy="9" block="false" />
	<blocked dx="5" dy="8" block="false" />
	<blocked dx="5" dy="7" block="false" />
	<blocked dx="5" dy="6" block="false" />
	<blocked dx="5" dy="5" block="false" />
	<blocked dx="-1" dy="3" block="false" />
	<blocked dx="0" dy="4" block="false" />
	<blocked dx="-2" dy="2" block="false" />
	<blocked dx="1" dy="5" block="false" />
	<blocked dx="2" dy="6" block="false" />
	<blocked dx="6" dy="2" block="false" />
	<blocked dx="6" dy="3" block="false" />
	<blocked dx="6" dy="4" block="false" />
	<blocked dx="7" dy="2" block="false" />
	<blocked dx="7" dy="1" block="false" />
	<blocked dx="6" dy="0" block="false" />
	<blocked dx="5" dy="-1" block="false" />
	<blocked dx="4" dy="-2" block="false" />
	<blocked dx="3" dy="-3" block="false" />
	<blocked dx="2" dy="-4" block="false" />
	<blocked dx="-7" dy="-1" block="false" />
	<blocked dx="-7" dy="-2" block="false" />
	<blocked dx="-7" dy="-3" block="false" />
	<blocked dx="-1" dy="4" block="false" />
	<blocked dx="1" dy="-5" block="false" />
	<blocked dx="0" dy="-6" block="false" />
	<blocked dx="-1" dy="-7" block="false" />
	<blocked dx="-5" dy="-9" block="false" />
	<blocked dx="-6" dy="-10" block="false" />
	<blocked dx="-6" dy="-12" block="false" />
	<blocked dx="-5" dy="-11" block="false" />
	<blocked dx="-6" dy="-11" block="false" />
	<blocked dx="-4" dy="-10" block="false" />
	<blocked dx="-3" dy="-9" block="false" />
	<blocked dx="-2" dy="-8" block="false" />
	<blocked dx="7" dy="3" block="false" />
	<blocked dx="6" dy="5" block="false" />
	<blocked dx="-6" dy="-5" block="false" />
	<blocked dx="-5" dy="-5" block="false" />
	<blocked dx="-7" dy="-5" block="false" />
	<blocked dx="-7" dy="-4" block="false" />
	<blocked dx="2" dy="7" block="false" />
	<blocked dx="3" dy="8" block="false" />

	<door dx="-1" dy="3" />

	<constructionStack dx="1" dy="6" material="PLANK" buildrequired="8" />
	<constructionStack dx="3" dy="7" material="PLANK" buildrequired="4" />
	<constructionStack dx="5" dy="9" material="STONE" buildrequired="8" />

	<bricklayer dx="5" dy="3" direction="NORTH_WEST" />
	<bricklayer dx="-6" dy="0" direction="NORTH_EAST" />
	<bricklayer dx="-2" dy="2" direction="NORTH_EAST" />
	<bricklayer dx="2" dy="6" direction="NORTH_EAST" />
	<bricklayer dx="1" dy="5" direction="NORTH_EAST" />
	<bricklayer dx="5" dy="7" direction="NORTH_WEST" />
	<bricklayer dx="5" dy="5" direction="NORTH_WEST" />
	<bricklayer dx="6" dy="2" direction="NORTH_WEST" />

	<flag dx="0" dy="5" />

	<buildmark dx="-5" dy="0" />
	<buildmark dx="-3" dy="2" />
	<buildmark dx="1" dy="5" />
	<buildmark dx="3" dy="7" />
	<buildmark dx="-4" dy="-4" />
	<buildmark dx="-4" dy="-9" />
	<buildmark dx="6" dy="1" />
	<buildmark dx="4" dy="6" />

	<image file="34" for="GUI" type="GUI" sequence="66" image="0"/>
    <image file="33" type="SETTLER" for="FINAL" image="0" sequence="13"/>
    <image file="33" type="SETTLER" for="BUILD" image="1" sequence="13"/>
    <image file="33" type="SETTLER" for="FINAL" image="2" sequence="13"/>

    <!--  INFRANTARY: (,) (,) (,) (,) (,) -->
    <occupyer type="INFANTRY" offsetX="-87" offsetY="30" soldierX="-6" soldierY="-3" looksRight="false" />
    <occupyer type="INFANTRY" offsetX="-15" offsetY="-21" soldierX="0" soldierY="2" looksRight="false" />
    <occupyer type="INFANTRY" offsetX="11" offsetY="-22" soldierX="2" soldierY="3" looksRight="true" />
    <occupyer type="INFANTRY" offsetX="78" offsetY="37" soldierX="3" soldierY="-1" looksRight="true" />
    <occupyer type="INFANTRY" offsetX="43" offsetY="41" soldierX="0" soldierY="2" looksRight="false" />
	<occupyer type="INFANTRY" offsetX="-40" offsetY="36" soldierX="1" soldierY="3" looksRight="false" />

    <occupyer type="BOWMAN" offsetX="8" offsetY="3" soldierX="-1" soldierY="-1" />
    <occupyer type="BOWMAN" offsetX="-64" offsetY="53" soldierX="0" soldierY="-1" />

    <occupyer type="BOWMAN" offsetX="76" offsetY="64" soldierX="-7" soldierY="-5" />
    <occupyer type="BOWMAN" offsetX="61" offsetY="74" soldierX="-6" soldierY="-5" />


</building>
