<?xml version="1.1" encoding="UTF-8"?>
<!DOCTYPE building SYSTEM "../building.dtd">
<building worker="MINER" mine="true">
    <ground groundtype="MOUNTAIN" />
	<ground groundtype="MOUNTAINBORDER" />
	<ground groundtype="MOUNTAINBORDEROUTER" />
	<ground groundtype="GRASS"/>
	<ground groundtype="EARTH"/>
	<ground groundtype="FLATTENED"/>

	<blocked dx="1" dy="3" />
	<blocked dx="0" dy="-2" />
	<blocked dx="2" dy="3" />
	<blocked dx="1" dy="2" />
	<blocked dx="1" dy="1" />
	<blocked dx="0" dy="0" />
	<blocked dx="-1" dy="-1" />
	<blocked dx="-1" dy="0" />
	<blocked dx="-1" dy="1" />
	<blocked dx="0" dy="1" />
	<blocked dx="-2" dy="0" />
	<blocked dx="-2" dy="-1" />
	<blocked dx="-2" dy="-2" />
	<blocked dx="2" dy="2" />
	<blocked dx="2" dy="1" />
	<blocked dx="2" dy="0" />
	<blocked dx="1" dy="-1" />
	<blocked dx="1" dy="0" />
	<blocked dx="0" dy="-1" />
	<blocked dx="-1" dy="-2" />
	<blocked dx="-1" dy="-3" />

	<blocked dx="3" dy="2" block="false" />
	<blocked dx="3" dy="3" block="false" />
	<blocked dx="3" dy="4" block="false" />
	<blocked dx="2" dy="4" block="false" />
	<blocked dx="1" dy="4" block="false" />
	<blocked dx="0" dy="3" block="false" />
	<blocked dx="0" dy="2" block="false" />
	<blocked dx="-2" dy="1" block="false" />
	<blocked dx="-3" dy="0" block="false" />
	<blocked dx="-3" dy="-1" block="false" />
	<blocked dx="-3" dy="-2" block="false" />
	<blocked dx="-3" dy="-3" block="false" />
	<blocked dx="-2" dy="-4" block="false" />
	<blocked dx="-1" dy="-4" block="false" />
	<blocked dx="0" dy="-3" block="false" />
	<blocked dx="1" dy="-2" block="false" />
	<blocked dx="2" dy="-1" block="false" />
	<blocked dx="3" dy="0" block="false" />
	<blocked dx="-1" dy="2" block="false" />
	<blocked dx="0" dy="4" block="false" />
	<blocked dx="3" dy="1" block="false" />
	<blocked dx="-2" dy="-3" block="false" />

	<door dx="0" dy="2" />

	<constructionStack dx="0" dy="3" material="PLANK" buildrequired="4" />
	<constructionStack dx="2" dy="4" material="STONE" buildrequired="1" />
	<requestStack dx="3" dy="4" material="BREAD" />
	<requestStack dx="3" dy="2" material="MEAT" />
	<requestStack dx="3" dy="0" material="FISH" />
	<offerStack dx="0" dy="4" material="IRONORE" />

	<bricklayer dx="-1" dy="2" direction="NORTH_EAST" />
	<bricklayer dx="1" dy="4" direction="NORTH_EAST" />
	<bricklayer dx="3" dy="3" direction="NORTH_WEST" />
	<bricklayer dx="3" dy="2" direction="NORTH_WEST" />
	<bricklayer dx="3" dy="4" direction="NORTH_WEST" />

	<flag dx="0" dy="0" />

	<buildmark dx="-2" dy="0" />
	<buildmark dx="-2" dy="-3" />
	<buildmark dx="1" dy="3" />
	<buildmark dx="1" dy="0" />
	<buildmark dx="3" dy="1" />

	<mine dropDirection="SOUTH_WEST" miningInterval="3" foodOrder="MEAT,BREAD,FISH"/>

    <image file="14" for="GUI" type="GUI" sequence="45" image="0" />
    <image file="13" for="FINAL" type="SETTLER" sequence="4" image="0" />
    <image file="13" for="BUILD" type="SETTLER" sequence="4" image="1" />

</building>
