<?xml version="1.1" encoding="UTF-8"?>
<!DOCTYPE building SYSTEM "../building.dtd">
<building worker="LUMBERJACK" workradius="30">
	<ground groundtype="GRASS" />
	<ground groundtype="EARTH" />
	<ground groundtype="DESERT" />
	<ground groundtype="DESERTBORDER"/>
	<ground groundtype="DESERTBORDEROUTER"/>
	<ground groundtype="DRY_GRASS"/>
	<ground groundtype="FLATTENED_DESERT"/>
	<ground groundtype="SHARP_FLATTENED_DESERT"/>
	<ground groundtype="FLATTENED" />

	<blocked dx="-3" dy="-1" />
	<blocked dx="-3" dy="-2" />
	<blocked dx="-3" dy="-3" />
	<blocked dx="-2" dy="-3" />
	<blocked dx="-1" dy="-2" />
	<blocked dx="0" dy="-1" />
	<blocked dx="1" dy="0" />
	<blocked dx="-1" dy="-3" />
	<blocked dx="0" dy="-2" />
	<blocked dx="1" dy="-1" />
	<blocked dx="2" dy="1" />
	<blocked dx="-2" dy="-1" />
	<blocked dx="-2" dy="-2" />
	<blocked dx="-1" dy="-1" />
	<blocked dx="0" dy="0" />
	<blocked dx="1" dy="1" />
	<blocked dx="2" dy="2" />
	<blocked dx="1" dy="2" />
	<blocked dx="0" dy="1" />
	<blocked dx="-1" dy="0" />
	<blocked dx="2" dy="0" />
	<blocked dx="1" dy="4" />
	<blocked dx="-3" dy="-4" />
	<blocked dx="-3" dy="-5" />
	<blocked dx="2" dy="3" />
	<blocked dx="-1" dy="1" />
	<blocked dx="0" dy="4" />
	<blocked dx="1" dy="5" />
	<blocked dx="-2" dy="-4" />
	<blocked dx="-3" dy="0" />
	<blocked dx="2" dy="5" />
	<blocked dx="-2" dy="0" />
	<blocked dx="2" dy="-1" />
	<blocked dx="1" dy="-2" />
	<blocked dx="0" dy="-3" />
	<blocked dx="-1" dy="-4" />
	<blocked dx="-2" dy="-5" />
	<blocked dx="-3" dy="-6" />

	<blocked dx="-1" dy="3" block="false" />
	<blocked dx="-1" dy="2" block="false" />
	<blocked dx="-4" dy="-3" block="false" />
	<blocked dx="-4" dy="-2" block="false" />
	<blocked dx="-4" dy="-1" block="false" />
	<blocked dx="0" dy="2" block="false" />
	<blocked dx="1" dy="3" block="false" />
	<blocked dx="3" dy="0" block="false" />
	<blocked dx="3" dy="1" block="false" />
	<blocked dx="3" dy="3" block="false" />
	<blocked dx="3" dy="2" block="false" />
	<blocked dx="3" dy="4" block="false" />
	<blocked dx="3" dy="5" block="false" />
	<blocked dx="0" dy="5" block="false" />
	<blocked dx="1" dy="6" block="false" />
	<blocked dx="-1" dy="4" block="false" />
	<blocked dx="3" dy="-1" block="false" />
	<blocked dx="2" dy="-2" block="false" />
	<blocked dx="1" dy="-3" block="false" />
	<blocked dx="0" dy="-4" block="false" />
	<blocked dx="-1" dy="-5" block="false" />
	<blocked dx="-2" dy="-6" block="false" />
	<blocked dx="-4" dy="-6" block="false" />
	<blocked dx="-4" dy="-5" block="false" />
	<blocked dx="-4" dy="-4" block="false" />
	<blocked dx="-2" dy="2" block="false" />
	<blocked dx="-3" dy="1" block="false" />
	<blocked dx="-4" dy="0" block="false" />
	<blocked dx="3" dy="6" block="false" />
	<blocked dx="2" dy="6" block="false" />
	<blocked dx="0" dy="3" block="false" />
	<blocked dx="2" dy="4" block="false" />
	<blocked dx="-2" dy="1" block="false" />
	<blocked dx="-4" dy="-7" block="false" />
	<blocked dx="-3" dy="-7" block="false" />

	<door dx="-2" dy="1" />

	<constructionStack dx="-2" dy="2" material="PLANK" buildrequired="1" />
	<constructionStack dx="-1" dy="2" material="STONE" buildrequired="3" />
	<offerStack dx="-2" dy="2" material="TRUNK" />

	<bricklayer dx="-2" dy="1" direction="NORTH_EAST" />
	<bricklayer dx="0" dy="3" direction="NORTH_EAST" />
	<bricklayer dx="3" dy="2" direction="NORTH_WEST" />
	<bricklayer dx="3" dy="1" direction="NORTH_WEST" />

	<flag dx="-3" dy="-3" />

	<buildmark dx="-3" dy="-7" />
	<buildmark dx="-2" dy="-6" />
	<buildmark dx="3" dy="0" />
	<buildmark dx="3" dy="3" />
	<buildmark dx="2" dy="6" />
	<buildmark dx="-4" dy="-1" />

	<image file="24" for="GUI" image="0" sequence="0" type="GUI"/>
	<image file="23" for="FINAL" image="0" sequence="0" type="SETTLER"/>
	<image file="23" for="BUILD" image="1" sequence="0" type="SETTLER"/>

</building>
