<?xml version="1.0" encoding="UTF-8"?>
<!DOCTYPE building SYSTEM "../building.dtd" >
<building worker="HEALER" workradius="20">
	<ground groundtype="GRASS" />
	<ground groundtype="EARTH" />
	<ground groundtype="FLATTENED" />

	<blocked dx="-2" dy="-2" />
	<blocked dx="-2" dy="-1" />
	<blocked dx="-2" dy="0" />
	<blocked dx="-1" dy="1" />
	<blocked dx="-1" dy="0" />
	<blocked dx="-1" dy="-1" />
	<blocked dx="-1" dy="-2" />
	<blocked dx="0" dy="-2" />
	<blocked dx="0" dy="-1" />
	<blocked dx="0" dy="0" />
	<blocked dx="0" dy="1" />
	<blocked dx="1" dy="3" />
	<blocked dx="1" dy="2" />
	<blocked dx="1" dy="1" />
	<blocked dx="1" dy="0" />
	<blocked dx="1" dy="-1" />
	<blocked dx="2" dy="0" />
	<blocked dx="2" dy="1" />
	<blocked dx="2" dy="2" />
	<blocked dx="2" dy="3" />
	<blocked dx="3" dy="3" />
	<blocked dx="3" dy="2" />

	<blocked dx="4" dy="2" block="false" />
	<blocked dx="4" dy="3" block="false" />
	<blocked dx="2" dy="4" block="false" />
	<blocked dx="1" dy="4" block="false" />
	<blocked dx="0" dy="3" block="false" />
	<blocked dx="-1" dy="2" block="false" />
	<blocked dx="-2" dy="1" block="false" />
	<blocked dx="-3" dy="0" block="false" />
	<blocked dx="2" dy="5" block="false" />
	<blocked dx="3" dy="4" block="false" />
	<blocked dx="4" dy="4" block="false" />
	<blocked dx="1" dy="-2" block="false" />
	<blocked dx="3" dy="0" block="false" />
	<blocked dx="2" dy="-1" block="false" />
	<blocked dx="0" dy="-3" block="false" />
	<blocked dx="-3" dy="-4" block="false" />
	<blocked dx="-3" dy="-2" block="false" />
	<blocked dx="-3" dy="-3" block="false" />
	<blocked dx="-3" dy="-1" block="false" />
	<blocked dx="-2" dy="-4" block="false" />
	<blocked dx="-1" dy="-4" block="false" />
	<blocked dx="-2" dy="-3" block="false" />
	<blocked dx="-1" dy="-3" block="false" />
	<blocked dx="3" dy="1" block="false" />
	<blocked dx="0" dy="2" block="false" />
	<blocked dx="0" dy="4" block="false" />

	<door dx="0" dy="2" />

	<constructionStack dx="1" dy="4" material="PLANK" buildrequired="5" />
	<constructionStack dx="-1" dy="2" material="STONE" buildrequired="2" />

	<bricklayer dx="-2" dy="1" direction="NORTH_EAST" />
	<bricklayer dx="1" dy="4" direction="NORTH_EAST" />
	<bricklayer dx="3" dy="4" direction="NORTH_WEST" />
	<bricklayer dx="4" dy="2" direction="NORTH_WEST" />

	<flag dx="-3" dy="-4" />

	<buildmark dx="-3" dy="-5" />
	<buildmark dx="-3" dy="0" />
	<buildmark dx="2" dy="5" />
	<buildmark dx="4" dy="2" />
	<buildmark dx="-2" dy="-4" />

	<healspot dx="0" dy="4" />

	<image file="44" for="GUI" type="GUI" sequence="99" image="0"/>
	<image file="43" for="FINAL" type="SETTLER" sequence="34" image="0"/>
	<image file="43" for="BUILD" type="SETTLER" sequence="34" image="1"/>

</building>
