<?xml version="1.0" encoding="UTF-8"?>
<!DOCTYPE building SYSTEM "../building.dtd">
<building worker="" viewdistance="40">
    <ground groundtype="GRASS" />
    <ground groundtype="EARTH" />
    <ground groundtype="DESERT" />
    <ground groundtype="DESERTBORDER"/>
    <ground groundtype="DESERTBORDEROUTER"/>
    <ground groundtype="DRY_GRASS"/>
    <ground groundtype="FLATTENED_DESERT"/>
    <ground groundtype="SHARP_FLATTENED_DESERT"/>
    <ground groundtype="FLATTENED" />

    <blocked dx="-3" dy="0" />
    <blocked dx="-3" dy="-1" />
    <blocked dx="-2" dy="-1" />
    <blocked dx="-3" dy="-2" />
    <blocked dx="-2" dy="-3" />
    <blocked dx="-3" dy="-3" />
    <blocked dx="-2" dy="-2" />
    <blocked dx="-3" dy="-4" />
    <blocked dx="3" dy="0" />
    <blocked dx="2" dy="-1" />
    <blocked dx="1" dy="-2" />
    <blocked dx="0" dy="-3" />
    <blocked dx="-1" dy="-4" />
    <blocked dx="-2" dy="-4" />
    <blocked dx="-1" dy="-3" />
    <blocked dx="0" dy="-2" />
    <blocked dx="1" dy="-1" />
    <blocked dx="2" dy="0" />
    <blocked dx="3" dy="1" />
    <blocked dx="3" dy="2" />
    <blocked dx="2" dy="2" />
    <blocked dx="2" dy="3" />
    <blocked dx="3" dy="3" />
    <blocked dx="2" dy="4" />
    <blocked dx="1" dy="3" />
    <blocked dx="0" dy="2" />
    <blocked dx="-2" dy="1" />
    <blocked dx="-2" dy="0" />
    <blocked dx="-1" dy="0" />
    <blocked dx="0" dy="1" />
    <blocked dx="1" dy="2" />
    <blocked dx="1" dy="1" />
    <blocked dx="2" dy="1" />
    <blocked dx="1" dy="0" />
    <blocked dx="0" dy="-1" />
    <blocked dx="-1" dy="-2" />
    <blocked dx="-1" dy="-1" />
    <blocked dx="0" dy="0" />
    <blocked dx="0" dy="3" />
    <blocked dx="-1" dy="1" />

    <blocked dx="-1" dy="2" block="false" />
    <blocked dx="1" dy="4" block="false" />
    <blocked dx="2" dy="5" block="false" />
    <blocked dx="3" dy="5" block="false" />
    <blocked dx="3" dy="4" block="false" />
    <blocked dx="4" dy="4" block="false" />
    <blocked dx="4" dy="3" block="false" />
    <blocked dx="4" dy="2" block="false" />
    <blocked dx="4" dy="1" block="false" />
    <blocked dx="3" dy="-1" block="false" />
    <blocked dx="2" dy="-2" block="false" />
    <blocked dx="1" dy="-3" block="false" />
    <blocked dx="0" dy="-4" block="false" />
    <blocked dx="-1" dy="-5" block="false" />
    <blocked dx="-2" dy="-5" block="false" />
    <blocked dx="-3" dy="-5" block="false" />
    <blocked dx="-4" dy="-5" block="false" />
    <blocked dx="-4" dy="-4" block="false" />
    <blocked dx="-4" dy="-3" block="false" />
    <blocked dx="-4" dy="-2" block="false" />
    <blocked dx="-4" dy="-1" block="false" />
    <blocked dx="-4" dy="0" block="false" />
    <blocked dx="-3" dy="1" block="false" />
    <blocked dx="4" dy="5" block="false" />
    <blocked dx="0" dy="4" block="false" />
    <blocked dx="-2" dy="2" block="false" />
    <blocked dx="-1" dy="3" block="false" />
    <blocked dx="4" dy="0" block="false" />

    <door dx="-1" dy="2" />

    <constructionStack dx="4" dy="5" material="STONE" buildrequired="6" />
    <constructionStack dx="4" dy="2" material="PLANK" buildrequired="4" />

    <bricklayer dx="-3" dy="1" direction="NORTH_EAST" />
    <bricklayer dx="-1" dy="3" direction="NORTH_EAST" />
    <bricklayer dx="1" dy="4" direction="NORTH_EAST" />
    <bricklayer dx="3" dy="4" direction="NORTH_WEST" />
    <bricklayer dx="0" dy="4" direction="NORTH_EAST" />
    <bricklayer dx="-2" dy="2" direction="NORTH_EAST" />
    <bricklayer dx="4" dy="4" direction="NORTH_WEST" />
    <bricklayer dx="4" dy="2" direction="NORTH_WEST" />

    <flag dx="-1" dy="3" />

    <buildmark dx="-3" dy="0" />
    <buildmark dx="2" dy="4" />
    <buildmark dx="3" dy="0" />
    <buildmark dx="-2" dy="-4" />

    <image file="24" for="GUI" type="GUI" sequence="60" image="0" />
    <image file="23" type="SETTLER" for="FINAL" image="0" sequence="13" />
    <image file="23" type="SETTLER" for="BUILD" image="1" sequence="13" />
    <image file="23" type="SETTLER" for="FINAL" image="2" sequence="13" />

    <!-- lower left: (8,-6) (24,11) (41,23) -->
    <occupyer offsetX="-1" type="INFANTRY" offsetY="9" soldierX="0" soldierY="0" />
    <occupyer offsetX="18" type="INFANTRY" offsetY="22" soldierX="1" soldierY="0" />
    <occupyer offsetX="1" type="INFANTRY" offsetY="67" soldierX="1" soldierY="1" />

    <occupyer type="BOWMAN" 	offsetX="-29"	offsetY="39"	soldierX="-3"	soldierY="-3" 	/>
    <occupyer type="BOWMAN"		offsetX="-6"	offsetY="22"	soldierX="0"	soldierY="-3" 	/>
    <occupyer type="BOWMAN"		offsetX="-1"	offsetY="78"	soldierX="-4"	soldierY="-8" 	/>


</building>
