<!DOCTYPE building SYSTEM "../building.dtd">
<building worker="FISHERMAN" workradius="30">
	<ground groundtype="GRASS"/>
	<ground groundtype="EARTH"/>
	<ground groundtype="FLATTENED"/>

	<blocked dx="-1" dy="1" />
	<blocked dx="-1" dy="0" />
	<blocked dx="-1" dy="-1" />
	<blocked dx="-1" dy="-2" />
	<blocked dx="0" dy="-2" />
	<blocked dx="1" dy="-1" />
	<blocked dx="2" dy="2" />
	<blocked dx="1" dy="1" />
	<blocked dx="1" dy="0" />
	<blocked dx="0" dy="-1" />
	<blocked dx="0" dy="0" />
	<blocked dx="0" dy="1" />
	<blocked dx="0" dy="2" />
	<blocked dx="1" dy="3" />
	<blocked dx="1" dy="2" />
	<blocked dx="2" dy="3" />
	<blocked dx="2" dy="0" />
	<blocked dx="-1" dy="2" />
	<blocked dx="0" dy="3" />
	<blocked dx="1" dy="4" />
	<blocked dx="2" dy="4" />
	<blocked dx="2" dy="5" />
	<blocked dx="3" dy="5" />
	<blocked dx="3" dy="6" />
	<blocked dx="-2" dy="1" />
	<blocked dx="-2" dy="0" />
	<blocked dx="-2" dy="-2" />
	<blocked dx="-2" dy="-1" />
	<blocked dx="-1" dy="-3" />
	<blocked dx="-2" dy="-4" />
	<blocked dx="-2" dy="-3" />
	<blocked dx="-1" dy="-4" />
	<blocked dx="-2" dy="-5" />
	<blocked dx="2" dy="1" />
	<blocked dx="2" dy="-1" />
	<blocked dx="1" dy="-2" />
	<blocked dx="0" dy="-3" />

	<blocked dx="3" dy="4" block="false" />
	<blocked dx="3" dy="2" block="false" />
	<blocked dx="3" dy="1" block="false" />
	<blocked dx="3" dy="0" block="false" />
	<blocked dx="-1" dy="3" block="false" />
	<blocked dx="0" dy="4" block="false" />
	<blocked dx="-2" dy="2" block="false" />
	<blocked dx="4" dy="7" block="false" />
	<blocked dx="1" dy="5" block="false" />
	<blocked dx="2" dy="6" block="false" />
	<blocked dx="3" dy="7" block="false" />
	<blocked dx="4" dy="8" block="false" />
	<blocked dx="4" dy="5" block="false" />
	<blocked dx="3" dy="3" block="false" />
	<blocked dx="4" dy="6" block="false" />
	<blocked dx="-3" dy="1" block="false" />
	<blocked dx="-3" dy="0" block="false" />
	<blocked dx="-3" dy="-1" block="false" />
	<blocked dx="-3" dy="-2" block="false" />
	<blocked dx="-3" dy="-3" block="false" />
	<blocked dx="-3" dy="-4" block="false" />
	<blocked dx="-3" dy="-6" block="false" />
	<blocked dx="-3" dy="-5" block="false" />
	<blocked dx="-3" dy="-7" block="false" />
	<blocked dx="-2" dy="-6" block="false" />
	<blocked dx="-1" dy="-5" block="false" />
	<blocked dx="0" dy="-4" block="false" />
	<blocked dx="4" dy="4" block="false" />
	<blocked dx="1" dy="-3" block="false" />
	<blocked dx="2" dy="-2" block="false" />
	<blocked dx="3" dy="-1" block="false" />

	<door dx="3" dy="1" />

	<constructionStack dx="3" dy="0" material="PLANK" buildrequired="4" />
	<constructionStack dx="3" dy="2" material="STONE" buildrequired="1" />
	<offerStack dx="4" dy="4" material="FISH" />

	<bricklayer dx="3" dy="2" direction="NORTH_WEST" />
	<bricklayer dx="3" dy="3" direction="NORTH_WEST" />
	<bricklayer dx="-1" dy="3" direction="NORTH_EAST" />
	<bricklayer dx="0" dy="4" direction="NORTH_EAST" />

	<flag dx="-1" dy="-4" />

	<buildmark dx="3" dy="5" />
	<buildmark dx="-2" dy="-5" />
	<buildmark dx="2" dy="-1" />
	<buildmark dx="-2" dy="1" />



	<image file="34" for="GUI" type="GUI" sequence="21" image="0"/>
    <image file="33" type="SETTLER" for="FINAL" image="0" sequence="25"/>
    <image file="33" type="SETTLER" for="BUILD" image="1" sequence="25"/>

</building>
