<?xml version="1.0" encoding="UTF-8"?>
<!DOCTYPE building SYSTEM "../building.dtd" >
<building worker="SMITH">
	<ground groundtype="GRASS" />
	<ground groundtype="EARTH" />
	<ground groundtype="DESERT" />
	<ground groundtype="DESERTBORDER"/>
	<ground groundtype="DESERTBORDEROUTER"/>
	<ground groundtype="DRY_GRASS"/>
	<ground groundtype="FLATTENED_DESERT"/>
	<ground groundtype="SHARP_FLATTENED_DESERT"/>
	<ground groundtype="FLATTENED" />

	<blocked dx="2" dy="2" />
	<blocked dx="1" dy="1" />
	<blocked dx="0" dy="0" />
	<blocked dx="1" dy="2" />
	<blocked dx="0" dy="1" />
	<blocked dx="-1" dy="0" />
	<blocked dx="-3" dy="-1" />
	<blocked dx="-2" dy="-1" />
	<blocked dx="-2" dy="0" />
	<blocked dx="-2" dy="1" />
	<blocked dx="-3" dy="0" />
	<blocked dx="-3" dy="-2" />
	<blocked dx="-2" dy="-2" />
	<blocked dx="-1" dy="-1" />
	<blocked dx="1" dy="0" />
	<blocked dx="2" dy="1" />
	<blocked dx="3" dy="0" />
	<blocked dx="2" dy="-1" />
	<blocked dx="1" dy="-1" />
	<blocked dx="1" dy="-2" />
	<blocked dx="0" dy="-2" />
	<blocked dx="0" dy="-1" />
	<blocked dx="-1" dy="-2" />
	<blocked dx="-3" dy="-3" />
	<blocked dx="-2" dy="-3" />
	<blocked dx="-1" dy="-3" />
	<blocked dx="0" dy="-3" />
	<blocked dx="-2" dy="-4" />
	<blocked dx="-3" dy="-4" />
	<blocked dx="-1" dy="-4" />
	<blocked dx="3" dy="-1" />
	<blocked dx="2" dy="-2" />
	<blocked dx="0" dy="-4" />
	<blocked dx="1" dy="-3" />
	<blocked dx="3" dy="2" />
	<blocked dx="-3" dy="1" />
	<blocked dx="-1" dy="2" />
	<blocked dx="-1" dy="1" />
	<blocked dx="2" dy="0" />
	<blocked dx="0" dy="3" />
	<blocked dx="1" dy="3" />
	<blocked dx="0" dy="2" />
	<blocked dx="2" dy="3" />
	<blocked dx="3" dy="4" />
	<blocked dx="2" dy="4" />
	<blocked dx="1" dy="4" />

	<blocked dx="-3" dy="-6" block="false" />
	<blocked dx="-4" dy="-5" block="false" />
	<blocked dx="-4" dy="-4" block="false" />
	<blocked dx="-4" dy="0" block="false" />
	<blocked dx="3" dy="3" block="false" />
	<blocked dx="3" dy="1" block="false" />
	<blocked dx="4" dy="0" block="false" />
	<blocked dx="4" dy="1" block="false" />
	<blocked dx="4" dy="2" block="false" />
	<blocked dx="4" dy="3" block="false" />
	<blocked dx="4" dy="4" block="false" />
	<blocked dx="-2" dy="-6" block="false" />
	<blocked dx="-1" dy="-6" block="false" />
	<blocked dx="0" dy="-5" block="false" />
	<blocked dx="1" dy="-4" block="false" />
	<blocked dx="2" dy="-3" block="false" />
	<blocked dx="3" dy="-2" block="false" />
	<blocked dx="-4" dy="-3" block="false" />
	<blocked dx="-4" dy="-2" block="false" />
	<blocked dx="-4" dy="-1" block="false" />
	<blocked dx="-2" dy="3" block="false" />
	<blocked dx="-3" dy="2" block="false" />
	<blocked dx="-1" dy="4" block="false" />
	<blocked dx="-4" dy="1" block="false" />
	<blocked dx="-3" dy="-5" block="false" />
	<blocked dx="-2" dy="-5" block="false" />
	<blocked dx="-1" dy="-5" block="false" />
	<blocked dx="-4" dy="-6" block="false" />
	<blocked dx="0" dy="5" block="false" />
	<blocked dx="1" dy="5" block="false" />
	<blocked dx="3" dy="5" block="false" />
	<blocked dx="4" dy="5" block="false" />
	<blocked dx="2" dy="5" block="false" />
	<blocked dx="-1" dy="3" block="false" />
	<blocked dx="-2" dy="2" block="false" />
	<blocked dx="0" dy="4" block="false" />
	<blocked dx="4" dy="-1" block="false" />

	<door dx="3" dy="1" />

	<constructionStack dx="4" dy="3" material="PLANK" buildrequired="2" />
	<constructionStack dx="4" dy="1" material="STONE" buildrequired="6" />
	<requestStack dx="-3" dy="2" material="COAL" />
	<requestStack dx="4" dy="1" material="IRON" />

	<bricklayer dx="-2" dy="3" direction="NORTH_EAST" />
	<bricklayer dx="3" dy="3" direction="NORTH_WEST" />
	<bricklayer dx="4" dy="4" direction="NORTH_WEST" />
	<bricklayer dx="4" dy="2" direction="NORTH_WEST" />

	<flag dx="0" dy="-3" />

	<buildmark dx="3" dy="-1" />
	<buildmark dx="2" dy="-2" />
	<buildmark dx="2" dy="3" />
	<buildmark dx="1" dy="4" />
	<buildmark dx="-3" dy="1" />
	<buildmark dx="-2" dy="-4" />

	<smokePosition dx="1" dy="6" fire="true" />

	<ovenPosition dx="-2" dy="2" direction="NORTH_EAST" />

	<anvilPosition dx="2" dy="5" direction="NORTH_WEST"/>

	<smithDropPosition dx="4" dy="3" />

	<image file="24" for="GUI" type="GUI" sequence="30" image="0" />
	<image file="23" type="SETTLER" for="FINAL" image="0" sequence="10" />
	<image file="23" type="SETTLER" for="BUILD" image="1" sequence="10" />
</building>
