<?xml version="1.1" encoding="UTF-8"?>
<!DOCTYPE building SYSTEM "../building.dtd">
<building worker="FORESTER" workradius="18">
	<ground groundtype="GRASS"/>
	<ground groundtype="EARTH"/>
	<ground groundtype="FLATTENED"/>

	<blocked dx="-3" dy="-1" />
	<blocked dx="-3" dy="-2" />
	<blocked dx="-2" dy="-2" />
	<blocked dx="-1" dy="-2" />
	<blocked dx="0" dy="-2" />
	<blocked dx="-2" dy="-1" />
	<blocked dx="-1" dy="-1" />
	<blocked dx="0" dy="-1" />
	<blocked dx="1" dy="-1" />
	<blocked dx="-2" dy="0" />
	<blocked dx="-1" dy="0" />
	<blocked dx="0" dy="0" />
	<blocked dx="1" dy="0" />
	<blocked dx="-1" dy="1" />
	<blocked dx="0" dy="1" />
	<blocked dx="2" dy="3" />
	<blocked dx="0" dy="2" />
	<blocked dx="1" dy="2" />
	<blocked dx="2" dy="2" />
	<blocked dx="2" dy="0" />
	<blocked dx="3" dy="1" />
	<blocked dx="2" dy="1" />
	<blocked dx="1" dy="1" />
	<blocked dx="3" dy="2" />
	<blocked dx="3" dy="3" />
	<blocked dx="4" dy="2" />
	<blocked dx="4" dy="1" />
	<blocked dx="3" dy="0" />
	<blocked dx="2" dy="-1" />
	<blocked dx="1" dy="-2" />
	<blocked dx="1" dy="4" />
	<blocked dx="0" dy="3" />
	<blocked dx="-1" dy="2" />
	<blocked dx="-2" dy="1" />
	<blocked dx="-3" dy="0" />
	<blocked dx="-2" dy="2" />
	<blocked dx="-1" dy="4" />
	<blocked dx="0" dy="4" />
	<blocked dx="1" dy="3" />
	<blocked dx="-1" dy="3" />
	<blocked dx="-2" dy="3" />

	<blocked dx="0" dy="-3" block="false" />
	<blocked dx="4" dy="4" block="false" />
	<blocked dx="3" dy="4" block="false" />
	<blocked dx="2" dy="4" block="false" />
	<blocked dx="-4" dy="-2" block="false" />
	<blocked dx="-4" dy="-3" block="false" />
	<blocked dx="-4" dy="-1" block="false" />
	<blocked dx="-3" dy="-3" block="false" />
	<blocked dx="-2" dy="-3" block="false" />
	<blocked dx="-1" dy="-3" block="false" />
	<blocked dx="1" dy="-3" block="false" />
	<blocked dx="2" dy="-2" block="false" />
	<blocked dx="3" dy="-1" block="false" />
	<blocked dx="4" dy="0" block="false" />
	<blocked dx="5" dy="2" block="false" />
	<blocked dx="5" dy="1" block="false" />
	<blocked dx="5" dy="3" block="false" />
	<blocked dx="5" dy="4" block="false" />
	<blocked dx="-4" dy="0" block="false" />
	<blocked dx="-3" dy="1" block="false" />
	<blocked dx="-3" dy="2" block="false" />
	<blocked dx="-2" dy="4" block="false" />
	<blocked dx="0" dy="5" block="false" />
	<blocked dx="1" dy="5" block="false" />
	<blocked dx="2" dy="5" block="false" />
	<blocked dx="-1" dy="5" block="false" />
	<blocked dx="4" dy="3" block="false" />
	<blocked dx="-3" dy="3" block="false" />

	<door dx="4" dy="3" />

	<constructionStack dx="1" dy="5" material="STONE" buildrequired="1" />
	<constructionStack dx="3" dy="4" material="PLANK" buildrequired="3" />

	<bricklayer dx="3" dy="4" direction="NORTH_EAST" />
	<bricklayer dx="-1" dy="5" direction="NORTH_EAST" />
	<bricklayer dx="2" dy="5" direction="NORTH_WEST" />
	<bricklayer dx="2" dy="4" direction="NORTH_WEST" />

	<flag dx="2" dy="0" />

	<buildmark dx="-3" dy="-1" />
	<buildmark dx="0" dy="4" />
	<buildmark dx="1" dy="4" />
	<buildmark dx="4" dy="2" />
	<buildmark dx="4" dy="1" />
	<buildmark dx="-2" dy="-2" />
	<buildmark dx="1" dy="-2" />

	<image file="44" for="GUI" type="GUI" sequence="3" image="0"/>
	<image file="43" type="SETTLER" for="FINAL" image="0" sequence="12"/>
	<image file="43" type="SETTLER" for="BUILD" image="1" sequence="12"/>
</building>
