<?xml version="1.1" encoding="UTF-8"?>
<!DOCTYPE building SYSTEM "../building.dtd">
<building worker="ALCHEMIST">
	<ground groundtype="GRASS"/>
	<ground groundtype="EARTH"/>
	<ground groundtype="FLATTENED"/>

	<blocked dx="-3" dy="-1" />
	<blocked dx="-2" dy="-2" />
	<blocked dx="-3" dy="-3" />
	<blocked dx="-1" dy="-3" />
	<blocked dx="1" dy="-1" />
	<blocked dx="2" dy="1" />
	<blocked dx="2" dy="2" />
	<blocked dx="1" dy="0" />
	<blocked dx="1" dy="1" />
	<blocked dx="1" dy="2" />
	<blocked dx="0" dy="-2" />
	<blocked dx="0" dy="-1" />
	<blocked dx="0" dy="0" />
	<blocked dx="0" dy="1" />
	<blocked dx="0" dy="2" />
	<blocked dx="-1" dy="-2" />
	<blocked dx="-1" dy="-1" />
	<blocked dx="-1" dy="0" />
	<blocked dx="-1" dy="1" />
	<blocked dx="-2" dy="-1" />
	<blocked dx="-2" dy="0" />
	<blocked dx="-2" dy="1" />
	<blocked dx="-2" dy="-3" />
	<blocked dx="2" dy="0" />
	<blocked dx="0" dy="3" />
	<blocked dx="-3" dy="-2" />
	<blocked dx="-1" dy="2" />
	<blocked dx="-1" dy="3" />
	<blocked dx="0" dy="4" />
	<blocked dx="3" dy="3" />
	<blocked dx="3" dy="1" />

	<blocked dx="2" dy="4" block="false" />
	<blocked dx="1" dy="-2" block="false" />
	<blocked dx="1" dy="3" block="false" />
	<blocked dx="2" dy="3" block="false" />
	<blocked dx="2" dy="-1" block="false" />
	<blocked dx="3" dy="0" block="false" />
	<blocked dx="-2" dy="2" block="false" />
	<blocked dx="-3" dy="1" block="false" />
	<blocked dx="-4" dy="-1" block="false" />
	<blocked dx="-4" dy="-2" block="false" />
	<blocked dx="-4" dy="-3" block="false" />
	<blocked dx="-4" dy="-4" block="false" />
	<blocked dx="-3" dy="-4" block="false" />
	<blocked dx="-2" dy="-4" block="false" />
	<blocked dx="-1" dy="-4" block="false" />
	<blocked dx="0" dy="-3" block="false" />
	<blocked dx="1" dy="4" block="false" />
	<blocked dx="-3" dy="0" block="false" />
	<blocked dx="-1" dy="4" block="false" />
	<blocked dx="-2" dy="3" block="false" />
	<blocked dx="0" dy="5" block="false" />
	<blocked dx="1" dy="5" block="false" />
	<blocked dx="4" dy="4" block="false" />
	<blocked dx="3" dy="4" block="false" />
	<blocked dx="4" dy="3" block="false" />
	<blocked dx="4" dy="2" block="false" />
	<blocked dx="4" dy="1" block="false" />
	<blocked dx="3" dy="2" block="false" />

	<door dx="3" dy="2" />

	<constructionStack dx="1" dy="5" material="PLANK" buildrequired="5" />
	<constructionStack dx="2" dy="4" material="STONE" buildrequired="1" />
	<requestStack dx="-3" dy="1" material="SULFUR" />
	<requestStack dx="2" dy="4" material="GEMS" />
	<offerStack dx="4" dy="4" material="IRON" />
	<offerStack dx="4" dy="2" material="GOLD" />

	<bricklayer dx="-2" dy="2" direction="NORTH_EAST" />
	<bricklayer dx="1" dy="3" direction="NORTH_EAST" />
	<bricklayer dx="2" dy="3" direction="NORTH_WEST" />
	<bricklayer dx="4" dy="3" direction="NORTH_WEST" />

	<flag dx="2" dy="0" />

	<buildmark dx="-3" dy="0" />
	<buildmark dx="3" dy="4" />
	<buildmark dx="4" dy="3" />
	<buildmark dx="3" dy="0" />
	<buildmark dx="0" dy="-3" />
	<buildmark dx="-4" dy="-3" />
	<buildmark dx="0" dy="5" />
	
	<ovenPosition dx="0" dy="5" direction="NORTH_EAST"/>

	<image file="44" for="GUI" type="GUI" sequence="87" image="0"/>
    <image file="43" type="SETTLER" for="FINAL" image="0" sequence="0"/>
    <image file="43" type="SETTLER" for="BUILD" image="1" sequence="0"/>
 	
 </building>