<?xml version="1.1" encoding="UTF-8"?>
<!DOCTYPE building SYSTEM "../building.dtd">
<building worker="PIG_FARMER" workradius="0">
	<ground groundtype="GRASS" />
	<ground groundtype="EARTH" />
	<ground groundtype="FLATTENED" />

	<blocked dx="2" dy="4" />
	<blocked dx="5" dy="3" />
	<blocked dx="4" dy="4" />
	<blocked dx="5" dy="2" />
	<blocked dx="4" dy="3" />
	<blocked dx="4" dy="2" />
	<blocked dx="4" dy="1" />
	<blocked dx="4" dy="0" />
	<blocked dx="3" dy="-1" />
	<blocked dx="2" dy="-2" />
	<blocked dx="1" dy="-2" />
	<blocked dx="1" dy="-3" />
	<blocked dx="1" dy="-1" />
	<blocked dx="1" dy="0" />
	<blocked dx="0" dy="0" />
	<blocked dx="0" dy="-1" />
	<blocked dx="0" dy="-2" />
	<blocked dx="0" dy="-3" />
	<blocked dx="-1" dy="-4" />
	<blocked dx="-2" dy="-5" />
	<blocked dx="-2" dy="-4" />
	<blocked dx="-2" dy="-3" />
	<blocked dx="-2" dy="-2" />
	<blocked dx="-3" dy="-3" />
	<blocked dx="-3" dy="-4" />
	<blocked dx="-3" dy="-2" />
	<blocked dx="-3" dy="-1" />
	<blocked dx="-3" dy="0" />
	<blocked dx="-2" dy="-1" />
	<blocked dx="-2" dy="0" />
	<blocked dx="-1" dy="-3" />
	<blocked dx="-1" dy="-2" />
	<blocked dx="-1" dy="-1" />
	<blocked dx="-1" dy="0" />
	<blocked dx="0" dy="-4" />
	<blocked dx="-1" dy="1" />
	<blocked dx="-1" dy="2" />
	<blocked dx="2" dy="-1" />
	<blocked dx="3" dy="0" />
	<blocked dx="3" dy="4" />
	<blocked dx="-3" dy="-5" />
	<blocked dx="2" dy="3" />
	<blocked dx="3" dy="3" />
	<blocked dx="5" dy="4" />
	<blocked dx="6" dy="1" />
	<blocked dx="5" dy="1" />
	<blocked dx="5" dy="0" />
	<blocked dx="4" dy="-1" />
	<blocked dx="-4" dy="0" />
	<blocked dx="-4" dy="-4" />
	<blocked dx="-4" dy="-3" />
	<blocked dx="-4" dy="-2" />
	<blocked dx="-4" dy="-1" />
	<blocked dx="-4" dy="-5" />
	<blocked dx="-2" dy="1" />
	<blocked dx="-1" dy="3" />
	<blocked dx="6" dy="2" />

	<blocked dx="5" dy="5" block="false" />
	<blocked dx="6" dy="5" block="false" />
	<blocked dx="6" dy="4" block="false" />
	<blocked dx="6" dy="3" block="false" />
	<blocked dx="7" dy="2" block="false" />
	<blocked dx="3" dy="-2" block="false" />
	<blocked dx="2" dy="-3" block="false" />
	<blocked dx="1" dy="-4" block="false" />
	<blocked dx="0" dy="-5" block="false" />
	<blocked dx="-1" dy="-5" block="false" />
	<blocked dx="-2" dy="-6" block="false" />
	<blocked dx="-3" dy="-6" block="false" />
	<blocked dx="-4" dy="1" block="false" />
	<blocked dx="-3" dy="2" block="false" />
	<blocked dx="-1" dy="4" block="false" />
	<blocked dx="-2" dy="2" block="false" />
	<blocked dx="-2" dy="3" block="false" />
	<blocked dx="0" dy="4" block="false" />
	<blocked dx="1" dy="5" block="false" />
	<blocked dx="1" dy="4" block="false" />
	<blocked dx="1" dy="3" block="false" />
	<blocked dx="1" dy="2" block="false" />
	<blocked dx="1" dy="1" block="false" />
	<blocked dx="2" dy="1" block="false" />
	<blocked dx="3" dy="2" block="false" />
	<blocked dx="3" dy="1" block="false" />
	<blocked dx="2" dy="0" block="false" />
	<blocked dx="2" dy="2" block="false" />
	<blocked dx="-4" dy="-6" block="false" />
	<blocked dx="0" dy="1" block="false" />
	<blocked dx="5" dy="-1" block="false" />
	<blocked dx="4" dy="-2" block="false" />
	<blocked dx="3" dy="-3" block="false" />
	<blocked dx="2" dy="5" block="false" />
	<blocked dx="3" dy="5" block="false" />
	<blocked dx="4" dy="5" block="false" />
	<blocked dx="0" dy="5" block="false" />
	<blocked dx="6" dy="0" block="false" />
	<blocked dx="7" dy="1" block="false" />
	<blocked dx="7" dy="3" block="false" />
	<blocked dx="-5" dy="0" block="false" />
	<blocked dx="-5" dy="-2" block="false" />
	<blocked dx="-5" dy="-1" block="false" />
	<blocked dx="-5" dy="-3" block="false" />
	<blocked dx="-5" dy="-4" block="false" />
	<blocked dx="-5" dy="-5" block="false" />
	<blocked dx="-5" dy="-6" block="false" />
	<blocked dx="0" dy="3" block="false" />
	<blocked dx="0" dy="2" block="false" />
	<blocked dx="-3" dy="1" block="false" />

	<door dx="0" dy="1" />

	<constructionStack dx="1" dy="5" material="PLANK" buildrequired="8" />
	<constructionStack dx="3" dy="5" material="STONE" buildrequired="3" />
	<requestStack dx="5" dy="5" material="WATER" />
	<requestStack dx="6" dy="4" material="CROP" />
	<offerStack dx="2" dy="5" material="PIG" />

	<bricklayer dx="-3" dy="2" direction="NORTH_EAST" />
	<bricklayer dx="-2" dy="3" direction="NORTH_EAST" />
	<bricklayer dx="6" dy="4" direction="NORTH_WEST" />
	<bricklayer dx="7" dy="3" direction="NORTH_WEST" />

	<flag dx="-2" dy="-3" />

	<buildmark dx="4" dy="5" />
	<buildmark dx="-4" dy="0" />
	<buildmark dx="-4" dy="-5" />
	<buildmark dx="0" dy="-5" />
	<buildmark dx="6" dy="1" />



	<pigFeedPosition dx="2" dy="1"/>

	<animalPosition dx="2" dy="0"/>
	<animalPosition dx="2" dy="2"/>
	<animalPosition dx="3" dy="1"/>
	<animalPosition dx="3" dy="2"/>

	<image file="34" type="GUI" for="GUI" image="0" sequence="69" />
	<image file="33" type="SETTLER" for="FINAL" image="0" sequence="18" />
	<image file="33" type="SETTLER" for="BUILD" image="1" sequence="18" />

</building>
