<?xml version="1.1" encoding="UTF-8"?><!DOCTYPE building SYSTEM "../building.dtd">

<building worker="LUMBERJACK" workradius="30">
	<ground groundtype="GRASS"/>
	<ground groundtype="EARTH"/>
	<ground groundtype="FLATTENED"/>

	<blocked dx="-3" dy="2"/>
	<blocked dx="-2" dy="2"/>
	<blocked dx="-3" dy="1"/>
	<blocked dx="-3" dy="-1"/>
	<blocked dx="-3" dy="-2"/>
	<blocked dx="-3" dy="-3"/>
	<blocked dx="-2" dy="-3"/>
	<blocked dx="-1" dy="-2"/>
	<blocked dx="0" dy="-1"/>
	<blocked dx="1" dy="0"/>
	<blocked dx="-1" dy="-3"/>
	<blocked dx="0" dy="-2"/>
	<blocked dx="1" dy="-1"/>
	<blocked dx="3" dy="1"/>
	<blocked dx="3" dy="2"/>
	<blocked dx="2" dy="1"/>
	<blocked dx="-2" dy="-1"/>
	<blocked dx="-2" dy="-2"/>
	<blocked dx="-1" dy="-1"/>
	<blocked dx="0" dy="0"/>
	<blocked dx="1" dy="1"/>
	<blocked dx="2" dy="2"/>
	<blocked dx="3" dy="3"/>
	<blocked dx="2" dy="3"/>
	<blocked dx="1" dy="2"/>
	<blocked dx="0" dy="1"/>
	<blocked dx="-1" dy="0"/>
	<blocked dx="-2" dy="0"/>
	<blocked dx="0" dy="2"/>
	<blocked dx="1" dy="3"/>
	<blocked dx="2" dy="0"/>
	<blocked dx="-3" dy="0"/>
	<blocked dx="-2" dy="1"/>
	<blocked block="false" dx="-4" dy="2"/>
	<blocked block="false" dx="-3" dy="3"/>
	<blocked block="false" dx="-2" dy="3"/>
	<blocked block="false" dx="-1" dy="3"/>
	<blocked block="false" dx="-1" dy="2"/>
	<blocked block="false" dx="-1" dy="1"/>
	<blocked block="false" dx="0" dy="3"/>
	<blocked block="false" dx="1" dy="5"/>
	<blocked block="false" dx="1" dy="4"/>
	<blocked block="false" dx="2" dy="5"/>
	<blocked block="false" dx="3" dy="5"/>
	<blocked block="false" dx="2" dy="4"/>
	<blocked block="false" dx="3" dy="4"/>
	<blocked block="false" dx="4" dy="4"/>
	<blocked block="false" dx="4" dy="3"/>
	<blocked block="false" dx="4" dy="2"/>
	<blocked block="false" dx="4" dy="1"/>
	<blocked block="false" dx="3" dy="0"/>
	<blocked block="false" dx="2" dy="-1"/>
	<blocked block="false" dx="1" dy="-2"/>
	<blocked block="false" dx="0" dy="-3"/>
	<blocked block="false" dx="-1" dy="-4"/>
	<blocked block="false" dx="-2" dy="-4"/>
	<blocked block="false" dx="-3" dy="-4"/>
	<blocked block="false" dx="-4" dy="-4"/>
	<blocked block="false" dx="-4" dy="-3"/>
	<blocked block="false" dx="-4" dy="-2"/>
	<blocked block="false" dx="0" dy="4"/>
	<blocked block="false" dx="-4" dy="-1"/>
	<blocked block="false" dx="-4" dy="0"/>
	<blocked block="false" dx="-4" dy="1"/>

	<door dx="-1" dy="1"/>
	<constructionStack buildrequired="2" dx="0" dy="4" material="STONE"/>
	<constructionStack buildrequired="2" dx="3" dy="5" material="PLANK"/>
	<offerStack dx="0" dy="3" material="TRUNK"/>

	<bricklayer direction="NORTH_EAST" dx="-1" dy="2"/>
	<bricklayer direction="NORTH_EAST" dx="0" dy="3"/>
	<bricklayer direction="NORTH_WEST" dx="4" dy="3"/>
	<bricklayer direction="NORTH_WEST" dx="3" dy="4"/>

	<flag dx="-3" dy="-3"/>

	<buildmark dx="-3" dy="-1"/>
	<buildmark dx="1" dy="3"/>
	<buildmark dx="3" dy="3"/>
	<buildmark dx="3" dy="1"/>
	<buildmark dx="-1" dy="-3"/>
	<buildmark dx="-3" dy="1"/>

	<image file="14" for="GUI" image="0" sequence="0" type="GUI"/>
	<image file="13" for="FINAL" image="0" sequence="0" type="SETTLER"/>
	<image file="13" for="BUILD" image="1" sequence="0" type="SETTLER"/>

</building>
