<?xml version="1.1" encoding="UTF-8"?>
<!DOCTYPE building SYSTEM "../building.dtd">
<building worker="SAWMILLER">
	<ground groundtype="GRASS"/>
	<ground groundtype="EARTH"/>
	<ground groundtype="FLATTENED"/>

	<blocked dx="4" dy="4" />
	<blocked dx="4" dy="1" />
	<blocked dx="3" dy="1" />
	<blocked dx="2" dy="0" />
	<blocked dx="1" dy="0" />
	<blocked dx="1" dy="-1" />
	<blocked dx="-1" dy="-2" />
	<blocked dx="3" dy="0" />
	<blocked dx="0" dy="-2" />
	<blocked dx="0" dy="-1" />
	<blocked dx="2" dy="1" />
	<blocked dx="3" dy="2" />
	<blocked dx="3" dy="3" />
	<blocked dx="3" dy="4" />
	<blocked dx="1" dy="3" />
	<blocked dx="0" dy="2" />
	<blocked dx="0" dy="3" />
	<blocked dx="2" dy="3" />
	<blocked dx="2" dy="2" />
	<blocked dx="1" dy="1" />
	<blocked dx="1" dy="2" />
	<blocked dx="0" dy="0" />
	<blocked dx="0" dy="1" />
	<blocked dx="-1" dy="-1" />
	<blocked dx="-1" dy="0" />
	<blocked dx="-1" dy="1" />
	<blocked dx="-1" dy="2" />
	<blocked dx="-2" dy="1" />
	<blocked dx="-2" dy="0" />
	<blocked dx="-2" dy="-1" />
	<blocked dx="-2" dy="-2" />
	<blocked dx="2" dy="-1" />
	<blocked dx="1" dy="-2" />
	<blocked dx="-3" dy="-1" />
	<blocked dx="-3" dy="-2" />
	<blocked dx="-3" dy="0" />
	<blocked dx="4" dy="2" />
	<blocked dx="1" dy="4" />
	<blocked dx="2" dy="4" />

	<blocked dx="5" dy="4" block="false" />
	<blocked dx="5" dy="5" block="false" />
	<blocked dx="4" dy="5" block="false" />
	<blocked dx="2" dy="5" block="false" />
	<blocked dx="1" dy="5" block="false" />
	<blocked dx="0" dy="4" block="false" />
	<blocked dx="-1" dy="3" block="false" />
	<blocked dx="-2" dy="2" block="false" />
	<blocked dx="-3" dy="1" block="false" />
	<blocked dx="-3" dy="-3" block="false" />
	<blocked dx="0" dy="-3" block="false" />
	<blocked dx="1" dy="-3" block="false" />
	<blocked dx="2" dy="-2" block="false" />
	<blocked dx="3" dy="-1" block="false" />
	<blocked dx="4" dy="0" block="false" />
	<blocked dx="5" dy="1" block="false" />
	<blocked dx="5" dy="2" block="false" />
	<blocked dx="3" dy="5" block="false" />
	<blocked dx="5" dy="3" block="false" />
	<blocked dx="-2" dy="-3" block="false" />
	<blocked dx="-1" dy="-3" block="false" />
	<blocked dx="-4" dy="-3" block="false" />
	<blocked dx="-4" dy="-2" block="false" />
	<blocked dx="-4" dy="-1" block="false" />
	<blocked dx="-4" dy="0" block="false" />
	<blocked dx="4" dy="3" block="false" />
	<blocked dx="2" dy="6" block="false" />
	<blocked dx="3" dy="6" block="false" />

	<door dx="4" dy="3" />

	<constructionStack dx="2" dy="6" material="PLANK" buildrequired="4" />
	<constructionStack dx="0" dy="4" material="STONE" buildrequired="3" />
	<requestStack dx="-2" dy="2" material="TRUNK" />
	<offerStack dx="5" dy="5" material="PLANK" />

	<bricklayer dx="-1" dy="3" direction="NORTH_EAST" />
	<bricklayer dx="0" dy="4" direction="NORTH_EAST" />
	<bricklayer dx="-2" dy="2" direction="NORTH_EAST" />
	<bricklayer dx="5" dy="3" direction="NORTH_WEST" />

	<flag dx="1" dy="-2" />

	<buildmark dx="1" dy="4" />
	<buildmark dx="4" dy="2" />
	<buildmark dx="-2" dy="1" />
	<buildmark dx="-3" dy="-2" />
	<buildmark dx="0" dy="-2" />

	<sawmillerWorkPosition dx="3" dy="5" direction="NORTH_WEST"/>

	<image file="44" type="GUI" for="GUI" image="0" sequence="6" />
    <image file="43" type="SETTLER" for="FINAL" image="0" sequence="6"/>
    <image file="43" type="SETTLER" for="BUILD" image="1" sequence="6"/>
</building>
